{
  "schema_version": 1,
  "brief": {
    "text": "Fix the multi-line word count",
    "constraints": [
      "Keep the CLI usage text"
    ],
    "requirements": [
      {
        "id": "REQ-MULTILINE",
        "text": "count splits on any whitespace",
        "kind": "command"
      }
    ]
  },
  "repo": {
    "worktree": ".",
    "base_ref": "HEAD"
  },
  "authorization": {
    "endstate": "local",
    "local": [
      "edit"
    ],
    "evidence": "operator asked for a local fix"
  },
  "execution": {
    "mode": "delegated",
    "concurrency": 2
  },
  "tasks": [
    {
      "id": "fix",
      "purpose": "fix it",
      "files": [
        "wordstat.py"
      ],
      "requirement_ids": [
        "REQ-MULTILINE"
      ]
    },
    {
      "id": "survey",
      "purpose": "read callers",
      "kind": "read",
      "depends_on": []
    }
  ],
  "policy": {
    "review": {
      "required": true,
      "role": "reviewer"
    },
    "role_overrides": {
      "reviewer": {
        "providerInstanceId": "codex",
        "model": "gpt-6-sol"
      }
    }
  }
}
