{
  "schema_version": 1,
  "brief": {
    "text": "Fix the multi-line word count",
    "constraints": [
      "Keep the CLI usage text"
    ],
    "requirements": [
      {
        "id": "REQ-MULTILINE",
        "text": "count splits on any whitespace",
        "kind": "command"
      }
    ]
  },
  "repo": {
    "worktree": ".",
    "base_ref": "HEAD"
  },
  "authorization": {
    "endstate": "local",
    "local": [
      "edit"
    ],
    "evidence": "operator asked for a local fix"
  },
  "execution": {
    "mode": "direct"
  }
}
